24ecc0d2571242e2,https://www.indeed.com/viewjob?&jk=24ecc0d2571242e2,Software Engineering Program - CCB,new,"JPMorgan Chase Bank, N.A.",3.9,"Plano, TX",NA,NA,2020-11-22,"With Tech Centers across the country (not just Columbus, OH), we have many exciting opportunities available. As you progress through the application process you will have an opportunity to discuss location preference.
Be a part of a dynamic and diverse team that engineers the large-scale, complex and resilient technology solutions that drive our global business. This program will allow you to help build and optimize digital applications and systems that support millions of customers, clients and employees worldwide.
When you work at JPMorgan Chase, you're not just working at a global financial institution. You're an integral part of one of the world's biggest tech companies. Across our global technology centers, our team of more than 50,000 technologists design, build, deploy and run everything from enterprise technology initiatives to big data and mobile solutions, as well as innovations in electronic payments, cybersecurity, machine learning and cloud development. As a firm, we're partnering with FinTech and Silicon Valley tech firms to deliver cutting-edge solutions to our clients and customers. Our $11 billion annual investment in technology enables us to hire people to create innovative solutions that will not only transform the financial services industry, but also change the world.
What to expect
Launching your career in our Software Engineer Program means you will:

Start with an in-depth induction program that teaches you about our businesses, builds on your knowledge of development methodologies, and sharpens your professional skills.

Dive head-first into creating innovative solutions that make a difference for our customers, clients and employees.

Create and improve the design, analytics, coding and testing for high-quality software and new products.

Own projects end-to-end , keeping teams and stakeholders up to speed on the progress of what's being developed.

Work and share ideas, information and innovation with our team of technologists from all over the world.

Develop through on-going training, mentorship and access to senior leaders.

Participate in our agile Force for Good teams to develop real-world technology solutions for nonprofit organizations through a series of ""side"" projects over several months.

Join an inspiring and curious team of technologists who will support you in developing new skills, experiencing new projects and businesses, and taking your career where you want to go.
Locations you may join in the United States:

Chicago, IL

Columbus, OH

Wilmington, DE

New York, NY

Plano, TX
You will be given the opportunity to select up to three location preferences on your application. Potential placement could include any of our offices within the city's metropolitan area.
About you
Our November 2020 intake welcomes individuals to apply that have obtained their foundational technology background in non-traditional ways including but not limited to technology bootcamps, workforce development programs and community colleges. JPMC values cognitive and experiential diversity and we believe if you're ready to put your passion for technology to work in a way that makes a real difference, you'll find your place in our Software Engineer Program.
Key skills include:

Foundational knowledge of programming languages (e.g., Python, Javascript, Java, C++, C#), databases, data structures and algorithms

Strong interpersonal and communication skills

Ability to thrive in a fast-paced, collaborative environment

Exceptional problem solving ability and analytical skills

Relevant leadership experience from community organization involvement or previous employment
This role is not eligible for employer immigration sponsorship. If you will require employer immigration sponsorship, you do not meet the basic requirements of this full-time role.
Join us
At JPMorgan Chase, we're creating positive change for the diverse communities we serve. We do this by championing your innovative ideas through a supportive culture that helps you every step of the way as you build your career.
We value the unique skills of every employee, and we're building a technology organization that thrives on diversity. We encourage professional growth and career development, and offer competitive benefits and compensation. If you're looking to build your career as part of a global technology team tackling big challenges that impact the lives of people and companies all around the world, we want to meet you.
What's Next?
Help us learn about you by submitting a complete and thoughtful application, which includes your resume. Your application and resume is a way for us to initially get to know you, so it's important to complete all relevant application questions so we have as much information about you as possible.
To get started, enter your email address. Your email address will be used to create and maintain your profile. If you are a current JPMC employee, use your JPMC email address to apply for jobs internally. Do not use an email address with "".edu"" extension as doing so could result in delays receiving updates regarding your candidacy.
After you confirm your application, we will review it to determine whether you meet certain required qualifications.
If you are advanced to the next step of the process, you'll receive an email invitation to complete a series of 12 games through the Pymetrics Platform. Pymetrics will allow you to showcase your potential beyond what you tell us in your resume and application form. It's an additional data point that helps us gain a better understanding of who you are as an individual. It should take no longer than 25-35 minutes to complete. If you have already completed the Pymetrics games, you will have the opportunity to submit your gameplay results for this specific application without having to replay the games.
Following completion of Pymetrics, you'll receive another email invitation to complete a coding challenge and video interview, powered by HireVue. This is your opportunity to further bring your resume to life and showcase your experience for our recruiting team and hiring managers.
After completing your coding challenge and video interview, you will be invited to complete a short survey where you will have the opportunity to specify which location you are most interested in.
Pymetrics, HireVue and a completed survey are required your application will not be considered for further review until you have completed them. We strongly encourage that you apply and complete these required elements as soon as possible, since programs will close as positions are filled.
JPMorgan Chase is committed to creating an inclusive work environment that respects all people for their unique skills, backgrounds and professional experiences. We strive to hire qualified, diverse candidates, and we will provide reasonable accommodations for known disabilities.
Visit jpmorganchase.com/careers for upcoming events, career advice, our locations and more.

Chase is a leading financial services firm, helping nearly half of America's households and small businesses achieve their financial goals through a broad range of financial products. Our mission is to create engaged, lifelong relationships and put our customers at the heart of everything we do. We also help small businesses, nonprofits and cities grow, delivering solutions to solve all their financial needs.
We recognize that our people are our strength and the diverse talents they bring to our global workforce are directly linked to our success. We are an equal opportunity employer and place a high value on diversity and inclusion at our company. We do not discriminate on the basis of any protected attribute, including race, religion, color, national origin, gender, sexual orientation, gender identity, gender expression, age, marital or veteran status, pregnancy or disability, or any other basis protected under applicable law. In accordance with applicable law, we make reasonable accommodations for applicants' and employees' religious practices and beliefs, as well as any mental health or physical disability needs.
Equal Opportunity Employer/Disability/Veterans"
45043813bd223ec3,https://www.indeed.com/viewjob?&jk=45043813bd223ec3,Mid-Level Software Engineers,new,BOEING,4.0,"St. Louis, MO 63103",NA,NA,2020-11-22,"The Boeing Company is currently seeking Mid-Level Software Engineers (Level 3) for roles located in St. Louis, MO . These positions will focus on supporting the Boeing Defense, Space & Security (BDS) business organization.

At Boeing, our software engineers use their expertise to dream up next generation software capabilities for some amazing aerospace platforms. Join us and you will have the unique opportunity to develop real-time embedded software for the most sophisticated military aircraft in the world.

We have multiple openings in Boeing Defense, Space & Security BDS for St. Louis and surrounding regions to support our aircraft, weapons, and engineering capabilities.

These Capability Centers support all of the following programs:
T-7A – the next generation trainer for the Air Force
F/A-18, EA-18G, F-15, F-22 – existing tactical fighter aircraft still in development with ongoing major upgrades
Engineering Capability Centers – specialized engineering for Platform Cybersecurity, Product Security, Flight Simulation, Radar Development, and Advanced Mission Systems

Qualified Candidates may have an opportunity to choose a specific assignment. If selected for an interview, a candidate may specify preferred areas of interest. Some positions may be eligible for part-time virtual work.

We work in a casual but professional environment with multi-disciplined teams of engineers that take pride in developing, integrating, testing and delivering innovative solutions. There is long-term potential for career growth into technical leadership or management positions and we value the curiosity, tenacity and imagination our engineers bring to our teams each day.

Position Responsibilities:
Software Algorithm Development using advance Machine Learning techniques
Software development, modeling, simulation, testing, and/or analysis using C, C++, C#, Python, Java, or Ada
Working with customers and other engineers to define requirements, such as understanding and agreeing upon the function of the software system
Architecting and designing software to meet current and future requirements
Implementing and testing software using a variety of technologies and software languages

Security Clearance and Export Control Requirements :
This position requires the ability to obtain a US Security Clearance for which the US Government requires US Citizenship. Ability to obtain Secret US Security clearance (Post-Start).

Basic Qualifications (Required):
Ability to obtain Secret US Security clearance (Post-Start)
Bachelor’s degree or greater in a technical field of study
3+ years of professional experience with C, C++, C#, Python, Java, or Ada
3+ years of experience with real-time embedded software development

Desired Qualifications/Experience :
Experience working in Agile software development framework
Familiar working with and/or developing software requirements/test methodology

Typical Education/Experience:
Highly qualified candidates may be eligible for a signing bonus
Education/experience typically acquired through advanced technical education from an accredited course of study in engineering, computer science, mathematics, physics or chemistry (e.g. Bachelor) and typically 5 or more years' related work experience or an equivalent combination of technical education and experience (e.g. PhD, Master+3 years' related work experience)
In the USA, ABET accreditation is the preferred, although not required, accreditation standard

Relocation:
Relocation assistance is provided for qualified candidates.

Boeing is a Drug Free Workplace where post offer applicants and employees are subject to testing for marijuana, cocaine, opioids, amphetamines, PCP, and alcohol when criteria is met as outlined in our policies."
a8f1c0b8d2a55220,https://www.indeed.com/viewjob?&jk=a8f1c0b8d2a55220,Boeing Graduate Researcher – Applied Mathematics,new,BOEING,4.0,"Huntsville, AL 35895",NA,NA,2020-11-22,"At Boeing, we are all innovators on a mission to connect, protect, explore and inspire. From the seabed to outer space, you’ll learn and grow, contributing to work that shapes the world. Find your future with us.

We are Boeing Research & Technology: Boeing's global research and development team creating and implementing innovative technologies that make the impossible possible and enabling the future of aerospace. We are engineers and technicians, skilled scientists and bold innovators.

We are looking for a Graduate Researcher - Applied Mathematician.

Position Responsibilities:
Interpret and formulate problems in mathematical or computational terms
Develop algorithms and evaluate resources to solve mathematical problems
Assist with mathematical research
Contribute to the development of research proposals
Influence colleagues and customers to use mathematical tools and processes
Code, test and maintain mathematical software tools

Join us and put your passion, determination, and skill to work building the future!

Basic Qualifications (Required Skill/Experience):
This position must meet Export Control compliance requirements, therefore a “US Person” as defined by 22 C.F.R. § 120.15 is required. “US Person” includes US Citizen, lawful permanent resident, refugee, or asylee.
Currently enrolled at an accredited college or university pursuing a Doctorate degree in applied math or related fields (e.g. operations research, optimization, applied statistics, machine learning, engineering, etc.)
The ability to work a minimum of 10 weeks (12 weeks preferred) in Summer 2021

Preferred Qualifications (Desired Skills/Experience):
Software programming skills and knowledge of at least one programming language such as Python, C, C++, R or experience with modeling & simulation software
Passion to develop mathematical/optimization/applied statistics/machine learning/data fusion research & development and apply mathematics to solve hard industrial problems
Excellent communication skills, the ability to adapt to changing environments and work statements and work in multidisciplinary teams
Strong desire to work with technical and non-technical audiences and be a self-starter
Ability to manage several simultaneous projects effectively and across various geographical locations

Relocation:
This position offers relocation based on candidate eligibility.

Drug Free Workplace:
Boeing is a Drug Free Workplace where post offer applicants and employees are subject to testing for marijuana, cocaine, opioids, amphetamines, PCP, and alcohol when criteria is met as outlined in our policies.

In locations where SPEEA representation applies, this job family will be covered by the terms of the collective bargaining agreement. Applicable and appropriate educational/certification credentials from an accredited institution and/or equivalent experience is required."
c9b9fde3ba428481,https://www.indeed.com/viewjob?&jk=c9b9fde3ba428481,Data & Applied Scientist II,new,Microsoft,4.2,"Redmond, WA",NA,NA,2020-11-22,"Xbox is one of the world’s most valuable brands and enjoys millions of players and passionate fans. An important part of our plan is to grow our global player base and our multi-billion dollar a year Xbox console and accessories business.

At Xbox, we believe Gamer Happiness is at the core to our mission of empowering every person and organization on the planet to achieve more. Here in Gaming Data Services (GDS), we work with a breadth and depth of partners across Xbox. We are looking for a data scientist to join our group and help us accelerate product development using experimentation, statistical analysis, and ML modeling. This candidate will work with product teams to accelerate their growth, enable data-driven and customer obsessed design, and build better experiences for Gaming. In this role you will have the opportunity to shape the use of experimentation in the Xbox organization, driving an end-to-end experimentation lifecycle including hypothesis generation, experimental design, implementation, and analysis. You will guide your stakeholders in their decision-making and collaborate with user research to understand the customer experience. The successful candidate will be passionate about data and the scientific method, and have a desire to apply their knowledge to improve Xbox products and services.
Responsibilities
Works with product managers, engineering, user researchers and other data scientists to formulate data-driven and scientifically rigorous answers to business problems and customer needs.
Drive innovation by developing new models, experimentation methodologies, statistical techniques, and causal-inference approaches that could sharpen our product decision-making process.
Builds and maintains trust relationships with product stakeholders and is motivated to enable them to build solutions with direct customer/ business impact.
Contribute to a team culture that embraces diversity and inclusion.
Qualifications
A MS or PhD in Statistics, Computer Science, Economics or related discipline is preferable, but a candidate with BS combined with meaningful hands on industry experience in problems relating to Data Science is also acceptable.
2 + years’ industry experience applying data science, machine learning, and statistics
Experience working with large distributed data sets to derive actionable insights.
Development experience in R/Python/SAS or similar programming language
Experience using large data systems on SQL, Hadoop, Hive queries, etc.
Strong communications skills, in particular written research results and effective presentations
#gamingjobs

Microsoft is an equal opportunity employer. All qualified applicants will receive consideration for employment without regard to age, ancestry, color, family or medical care leave, gender identity or expression, genetic information, marital status, medical condition, national origin, physical or mental disability, political affiliation, protected veteran status, race, religion, sex (including pregnancy), sexual orientation, or any other characteristic protected by applicable laws, regulations and ordinances. We also consider qualified applicants regardless of criminal histories, consistent with legal requirements. If you need assistance and/or a reasonable accommodation due to a disability during the application or the recruiting process, please send a request via the Accommodation request form.

Benefits/perks listed below may vary depending on the nature of your employment with Microsoft and the country where you work."
c3273b5b229b9118,https://www.indeed.com/viewjob?&jk=c3273b5b229b9118,Data Engineer,new,Hueman People Solutions,4.8,Florida,NA,NA,2020-11-22,"Data Engineer, Full-Time

We’re hiring for a Data Engineer in our Jacksonville Beach location!

The Hueman Team is looking for a dynamic individual that will focus on completing complex data projects and strategically advance our use of technology. The role is focused in 2 primary areas: Data Engineer and Technology/Innovation Research. The breakdown in responsibilities may evolve over time, but initially will be 80% Data Engineer and 20% Technology/Innovation Research. The role will occasionally interact directly with our clients as we roll-out new technology solutions and reporting. The role will require strong analytical and problem-solving skills, self-motivation and the ability to work independently. Our ideal candidate is someone with strong business acumen and ability to translate technology to potential business impacts with demonstrated ability to get to the essence of a new concept quickly.

As a Data Engineer:

You are responsible for expanding and optimizing our data and data pipeline architecture and optimizing data flow and collection across many disparate systems. The ideal candidate is an experienced data pipeline builder and data wrangler who enjoys optimizing data systems and building them from the ground up. The Data Engineer will manage our Business Intelligence Lead to support optimal data delivery architecture and consistent data mapping in order to optimize the data for analytics. They must be self-directed and comfortable supporting the data needs of multiple teams, systems and products. The right candidate will be excited by the prospect of optimizing or even re-designing our company’s data architecture to support our next generation of products and data initiatives.

Data Engineer Job Responsibilities:

Implement, verify, design, maintain software systems
Build data architecture for ingestion, processing, and surfacing of data for Business Intelligence applications
Extract data from one database/API and load it into another
Assemble large, complex data sets that meet functional / non-functional business requirements
Identify, design, and implement internal process improvements: automating manual processes, optimizing data delivery, re-designing infrastructure for greater scalability, etc.
Build the infrastructure required for optimal extraction, transformation, and loading of data from one database/API and load it into another
Build analytics tools that utilize the data pipeline to provide actionable insights into recruiter productivity, operational efficiency and other key business performance metrics
Work with stakeholders within Operations, Business Development, Marketing, and Data and Design teams to assist with data-related technical issues and support their data infrastructure needs
Use of many different scripting languages, understanding the nuances and benefits of each, to combine systems
Create data tools for analytics and Business Intelligence team members that assist them in building and optimizing our product into an innovative industry leader
Work with data and analytics experts to strive for greater functionality in our data systems
Research and discover new methods to acquire data, and new applications for existing data

As a Technology/Innovation Researcher:

You are responsible for spearheading our research into technologies that will enable Hueman to lead the industry and create a sustainable advantage for the company. The ideal candidate will aide leadership to identify and explore technology trends and execute a program to integrate new technologies/partners to Hueman.

Technology/Innovation Researcher Responsibilities:

Aide leadership in the discovery and evaluation of new technology platforms and trends
Develop and maintain a network of technology thought leaders and facilitate discussions of Hueman staff with this network
Provide regular updates on activities and learnings to all appropriate stakeholders
Integrate new technology into the business process and aide stakeholders in maximizing effectiveness and adoption
Lead research in areas/technologies that support Hueman’s mission
Identify, screen, and reach decisions on opportunities
Participate in assessment of technologies/partners/candidates to identify opportunity and help reach a recommendation for a path forward
Collaborate with leadership to identify potential platform technologies and develop the business case
Support technology development for long term sustainable advantage in our selected markets and divisions
Become the expert “connector”/networker of technology platforms

Requirements:

Desire and ability to adhere to Hueman’s core values and high standard of customer service every day
Experience with building and designing large-scale applications, database architecture and data mining/modeling
Statistical modeling and regression analysis and Distributed computing and splitting algorithms to yield predictive accuracy
Proficiency in languages, especially R, TSQL, SAS, Python, C/C++, Dax and database solution languages, especially SQL and Bigtable
Experience with operating systems, especially Linux, and Solaris
Experience with following tools is a plus: Hadoop, SQL Management Studio, Visual Studio/Code, Azure Datawarehouse, Data Bricks
Prior machine learning is preferred
Excellent verbal and written communication skills with strong customer focus·
Excellent organizational and follow up skills with strong attention to detail
Ability to meet time sensitive deadlines and adapt to a changing environment
Knowledge of front end of innovation tools and processes
Demonstrated success with creating a technology platform or new business development.

Hueman is a globally recognized organization, and is led by the only CEO & Leadership Team to ever have been selected to the Great Place to Work® and FORTUNE™ magazine’s Best Workplaces list for 14 consecutive years – securing the #1 spot in 2013. We’re excited about our company's growth! If you’re driven, love people, and want to work for a recognized Best Workplace, apply today."
