13def3c2775abc9c,https://www.indeed.com/viewjob?&jk=13def3c2775abc9c,Windows SDET (Remote),new,CrowdStrike,2.8,"Sunnyvale, CA 94086 (Washington area)",Remote,NA,2020-11-22,"At CrowdStrike we’re on a mission - to stop breaches. Our groundbreaking technology, services delivery, and intelligence gathering together with our innovations in machine learning and behavioral-based detection, allow our customers to not only defend themselves, but do so in a future-proof manner. We’ve earned numerous honors and top rankings for our technology, organization and people – clearly confirming our industry leadership and our special culture driving it. We also offer flexible work arrangements to help our people manage their personal and professional lives in a way that works for them. So if you’re ready to work on unrivaled technology where your desire to be part of a collaborative team is met with a laser-focused mission to stop breaches and protect people globally, let’s talk.

The Product
CrowdStrike Falcon Host is a two-component security product. One component is a “sensor”, which is a lightweight agent installed on client machines that observes system activity and recognizes malicious behavior, then provides on-box prevention capability and remote telemetry to the Falcon Host cloud. The cloud component aggregates sensor telemetry for each customer’s network, can correlate malicious behavior across multiple machines, and presents our customers’ operations teams with a prioritized summary of the threats detected in their environments.

About the Role
This is a Software Development Engineer in Test (SDET) position in the Windows sensor engineering team. At CrowdStrike, SDETs and SDEs work together in combined engineering teams. SDETs are key contributors in the team’s focus on quality of the sensor.

Here are the quality-focused tasks in the team that SDETs are heavily involved in:

Analyze complex software features, and build effective test strategies and test design

Build useful tools, frameworks, and test setup to use for developing tests effectively; the goal is to minimize manual testing and for the team to write automated tests for the product

Identify and write specialized tests necessary that are not feature-specific but are still important to ensure the quality of the system as a whole – performance, scalability, limits etc.

Debug bugs found through test or customer cases to identify root cause and use the input to improve tests

Work collaboratively with product and release management to control risk, improve quality, and streamline our release cycles

Rigorous product and test code reviews with an eye towards improving the security and robustness of the system as a whole

SDETs use their strong software development skills to build effective tools, harnesses, and specialized tests to assure that quality. SDETs also participate actively in design and code reviews, and collaborate with the cloud team to assure end-to-end system functionality.

The ideal SDET candidate must have demonstrated passion to find bugs -- i.e. they must like breaking software as much as writing code! They also must have demonstrated ability to write high-quality code in C or C++ and scripting languages like Python. Experience on Windows with code that has high reliability requirements; code that needs to pay attention to low-level operating characteristics (memory usage, efficient performance, correct conformance to external standards) is also highly desired.

What You’ll Need

Deeper understanding of fundamental computer science concepts; experience in analysis and implementation of data structures, algorithms, and software design

Ability to write and automate test cases, triage bugs, and write actionable bug reports

Ability to read code with a focus on its robustness and security (or lack thereof)

Ability to clearly define test strategies for features, and implement those strategies

A track record of shipping quality software
#LI-DG1
#LI-Remote

Benefits of Working at CrowdStrike:
Market leader in compensation and equity awards
Competitive vacation policy
Comprehensive health benefits + 401k plan
Paid parental leave, including adoption
Flexible work environment
Wellness programs
Stocked fridges, coffee, soda, and lots of treats

We are committed to building an inclusive culture of belonging that not only embraces the diversity of our people but also reflects the diversity of the communities in which we work and the customers we serve. We know that the happiest and highest performing teams include people with diverse perspectives and ways of solving problems so we strive to attract and retain talent from all backgrounds and create workplaces where everyone feels empowered to bring their full, authentic selves to work.
CrowdStrike is an Equal Opportunity employer. All qualified applicants will receive consideration for employment without regard to race, color, religion, sex including sexual orientation and gender identity, national origin, disability, protected veteran status, or any other characteristic protected by applicable federal, state, or local law.

CrowdStrike participates in the E-Verify program.
Notice of E-Verify Participation
Right to Work"
05cdb975ea44ba27,https://www.indeed.com/viewjob?&jk=05cdb975ea44ba27,Staff Machine Learning Engineer,new,Zendesk,4.1,California,NA,NA,2020-11-22,"Job Description
At Zendesk, our focus is helping our customers build great relationships with their customers. Founded by three Danish entrepreneurs, Zendesk has experienced remarkable success and growth while maintaining a fun, community-oriented, and down-to-earth culture.
Many years ago we recognised the power of machine learning to predict outcomes and guide people to potential answers when they have a question. We have built and launched a number of machine learning powered products such as Answer Bot, Content Cues and Satisfaction Prediction. These products are all developed out of Melbourne, Australia. In 2019, we’re excited to expand the footprint of the Data Science team to our San Francisco office with a goal to bring data driven smarts to our flagship Support product.
We are looking for an experienced Machine Learning Engineer to productionize machine learning features while helping feature teams in adding value to our products. You will have a dramatic impact on how 145,000+ businesses around the world help their customers.
What you get to do every day:
Build the platform that will accelerate the integration of ML features into our products
Design, develop key features and functionality of our ML platform
Work closely with data scientists to help bring ML powered features into production
Build and improve existing data pipelines
Collaborate with DevOps, feature teams, platform teams and product
Contribute to initiatives around improving the scalability and robustness of our platforms
Work alongside teammates in Melbourne and Copenhagen
What you bring to the role:
You should have some of these skills and qualifications:
Fluency in one or more of the following languages: Java/Scala/Python
Ability to navigate the stack from infrastructure to application and the mechanics behind the deployment and the scaling
Experience in structuring and deploying machine learning projects to production
Familiar in one of the machine learning libraries such as Tensorflow or Scikit-Learn
Ability to work with uncertainty and flexibility to pivot with changing priorities
Experience with cloud platforms such as AWS or GCP
Excellent written and verbal communication skills, comfortable with audiences including product and engineering management
A passion for ML/AI
Collaborative and can-do attitude
A burning desire to learn and grow
2+ years of work experience in data/machine learning software development
2+ years of work experience of building scalable backend services
5+ years of work experience in software engineering
What our tech stack looks like:
Our code is written in Java, Scala, Ruby, Python
Our servers live in AWS
Our machine learning models rely on Tensorflow and Scikit-Learn
Our ML pipelines use AWS Batch and EMR
Our team manages infrastructure using AWS Cloudformation and Chef
Our data is stored in S3, RDS MySQL, Redis, ElasticSearch and Aurora
Our services are deployed to Kubernetes using Docker and are backed by GraphQL endpoints
In your application, please include your GitHub/Bitbucket account if you have one.
The best customer experiences are built with Zendesk. Zendesk’s powerful and flexible customer service and engagement platform scales to meet the needs of any business, from startups and small businesses to growth companies and enterprises. Zendesk serves businesses across a multitude of industries, with more than 125,000 paid customer accounts offering service and support in more than 30 languages. Headquartered in San Francisco, Zendesk operates worldwide with 15 offices in North America, Europe, Asia, Australia, and South America. Learn more at www.zendesk.com.

Zendesk builds software for better customer relationships. It empowers organizations to improve customer engagement and better understand their customers. Zendesk products are easy to use and implement. They give organizations the flexibility to move quickly, focus on innovation, and scale with their growth.
More than 150,000 paid customer accounts in over 150 countries and territories use Zendesk products. Based in San Francisco, Zendesk has operations in the United States, Europe, Asia, Australia, and South America.
Interested in knowing what we do in the community? Check out the Zendesk Neighbor Foundation to learn more about how we engage with, and provide support to, our local communities.

Zendesk is an equal opportunity employer, and we’re proud of our ongoing efforts to foster global diversity, equity, & inclusion in the workplace. Individuals seeking employment at Zendesk are considered without regard to race, color, religion, national origin, age, sex, gender, gender identity, gender expression, sexual orientation, marital status, medical condition, ancestry, physical or mental disability, military or veteran status, or any other characteristic protected by applicable law.
By submitting your application, you agree that Zendesk may collect your personal data for recruiting, global organization planning, and related purposes. Zendesk's Candidate Privacy Notice explains what personal information Zendesk may process, where Zendesk may process your personal information, its purposes for processing your personal information, and the rights you can exercise over Zendesk’s use of your personal information."
a375a60f493a0953,https://www.indeed.com/viewjob?&jk=a375a60f493a0953,Site Reliability Engineer,new,"JPMorgan Chase Bank, N.A.",3.9,"Houston, TX",NA,NA,2020-11-22,"As a Site Reliability Engineer (SRE), you'll help build a meaningful engineering discipline, combining software and systems to develop creative engineering solutions to operations problems. Much of our support and software development focuses on optimizing existing systems, building infrastructure and reducing work through automation. You'll join a team of curious problem solvers with a diverse set of perspectives who are thinking big and taking risks. In this environment, you'll take the lead on relevant projects, supported by an organization that provides the support and mentorship you need to learn and grow. As an SRE, you'll be focused on running better production applications and systems.
Responsibilities:

Develop, test, and debug automated tasks (Apps, Systems, Infrastructure)
Troubleshoot priority incidents, facilitate blameless post-mortems
Work with development teams throughout the software life cycle ensuring sustainable software releases
Perform analytics on previous incidents and usage patterns to better predict issues and take proactive actions
Build and drive adoption for greater self-healing and resiliency patterns
Lead and participate in performance tests; identify bottlenecks, opportunities for optimization, and capacity demands
Participate in the 24x7 support coverage as needed

Qualifications:

Bachelor's degree or equivalent experience in a software engineering discipline
Mastery in at least two or more software languages (e.g. Python, Java, Go, etc.) with respect to designing, coding, testing, and software delivery
Adept in the development of automated tools, systems, and services in multiple technology domains
Advanced knowledge of one or more infrastructure components (e.g. networking, cloud services, orchestration tools, containerization, compute, and storage systems)
Proficiency in service-level changes to a system and troubleshooting components

Our Corporate Technology team relies on smart, driven people like you to develop applications and provide tech support for all our corporate functions across our network. Your efforts will touch lives all over the financial spectrum and across all our divisions: Global Finance, Corporate Treasury, Risk Management, Human Resources, Compliance, Legal, and within the Corporate Administrative Office. You'll be part of a team specifically built to meet and exceed our evolving technology needs, as well as our technology controls agenda.
When you work at JPMorgan Chase & Co., you're not just working at a global financial institution. You're an integral part of one of the world's biggest tech companies. In 14 technology hubs worldwide, our team of 40,000+ technologists design, build and deploy everything from enterprise technology initiatives to big data and mobile solutions, as well as innovations in electronic payments, cybersecurity, machine learning, and cloud development. Our $9.5B+ annual investment in technology enables us to hire people to create innovative solutions that will not only transform the financial services industry, but also change the world.
At JPMorgan Chase & Co. we value the unique skills of every employee, and we're building a technology organization that thrives on diversity. We encourage professional growth and career development, and offer competitive benefits and compensation. If you're looking to build your career as part of a global technology team tackling big challenges that impact the lives of people and companies all around the world, we want to meet youJPMorgan Chase & Co., one of the oldest financial institutions, offers innovative financial solutions to millions of consumers, small businesses and many of the world's most prominent corporate, institutional and government clients under the J.P. Morgan and Chase brands. Our history spans over 200 years and today we are a leader in investment banking, consumer and small business banking, commercial banking, financial transaction processing and asset management.
We recognize that our people are our strength and the diverse talents they bring to our global workforce are directly linked to our success. We are an equal opportunity employer and place a high value on diversity and inclusion at our company. We do not discriminate on the basis of any protected attribute, including race, religion, color, national origin, gender, sexual orientation, gender identity, gender expression, age, marital or veteran status, pregnancy or disability, or any other basis protected under applicable law. In accordance with applicable law, we make reasonable accommodations for applicants' and employees' religious practices and beliefs, as well as any mental health or physical disability needs.
Equal Opportunity Employer/Disability/Veterans"
1122852512c9cff8,https://www.indeed.com/viewjob?&jk=1122852512c9cff8,Software Engineer,new,Capital One,3.9,"Plano, TX 75023",NA,NA,2020-11-22,"Locations: TX - Plano, United States of America, Plano, Texas
Software Engineer
Do you love building and pioneering in the technology space? Do you enjoy solving complex business problems in a fast-paced, collaborative, inclusive, and iterative delivery environment? At Capital One, you'll be part of a big group of makers, breakers, doers and disruptors, who love to solve real problems and meet real customer needs.
We are seeking Software Engineers who are passionate about marrying data with emerging technologies to join our team. As a Capital One Software Engineer, you’ll have the opportunity to be on the forefront of driving a major transformation within Capital One. Learn more about #lifeatcapitalone and our commitment to diversity & inclusion by jumping to slides 76-91 on our Corporate Social Responsibility Report.
What You’ll Do:
Collaborate with and across Agile teams to design, develop, test, implement, and support technical solutions in full-stack development tools and technologies
Work with a team of developers with deep experience in machine learning, distributed microservices, and full stack systems
Share your passion for staying on top of tech trends, experimenting with and learning new technologies, participating in internal & external technology communities, and mentoring other members of the engineering community
Collaborate with digital product managers, and deliver robust cloud-based solutions that drive powerful experiences to help millions of Americans achieve financial empowerment
Work with cloud native stack, build on AWS, use technologies like Kubernetes and Serverless
Basic Qualifications:
Bachelor’s Degree
At least 2 years of experience in software engineering
Preferred Qualifications:
Master's Degree
2+ years of experience in Agile practices
1+ years of experience with AWS, GCP, Microsoft Azure, or another public cloud service
4+ years of experience in at least one of the following: Java, Scala, Python, Go, Javascript/TypeScript, Angular/React.js, or Node.js
2+ years of experience working with big data technologies (e.g. Hadoop, Spark, Presto)
2+ years of experience working on streaming data applications (e.g. Kafka, Kinesis, Flink, or Spark Streaming)
4+ years of experience in open source frameworks
At this time, Capital One will not sponsor a new applicant for employment authorization for this position."
